{
  "$schema": "http://json-schema.org/draft-07/schema#",
  "title": "arkiv",
  "type": "array",
  "items": {
    "type": "object",
    "additionalProperties": false,
    "required": ["handling_id", "koppling_id", "kalla_url", "arkiv_url", "verifierad", "datum"],
    "properties": {
      "handling_id": { "type": "string" },
      "koppling_id": { "type": "string" },
      "kalla_url": { "type": "string" },
      "arkiv_url": { "type": ["string", "null"] },
      "verifierad": { "type": "boolean" },
      "skal": { "type": "string" },
      "datum": { "type": "string" }
    }
  }
}
