[
  {
    "handling_id": "h-2026-3620",
    "koppling_id": "k-2026-0001",
    "kalla_url": "https://data.riksdagen.se/dokument/HA11610",
    "arkiv_url": null,
    "verifierad": false,
    "skal": "ingen arkivögonblicksbild kunde skapas",
    "datum": "2026-07-27"
  },
  {
    "handling_id": "h-2026-2074",
    "koppling_id": "k-2026-0002",
    "kalla_url": "https://data.riksdagen.se/dokument/HA022074",
    "arkiv_url": "https://web.archive.org/web/20221123134250/https://data.riksdagen.se/dokument/HA022074",
    "verifierad": true,
    "datum": "2026-07-27"
  },
  {
    "handling_id": "h-2026-10348",
    "koppling_id": "k-2026-0082",
    "kalla_url": "https://data.riksdagen.se/dokument/HC02107",
    "arkiv_url": "https://web.archive.org/web/20260727093931/https://data.riksdagen.se/dokument/HC02107",
    "verifierad": true,
    "datum": "2026-07-27"
  },
  {
    "handling_id": "h-2026-10983",
    "koppling_id": "k-2026-0093",
    "kalla_url": "https://data.riksdagen.se/dokument/HC02742",
    "arkiv_url": null,
    "verifierad": false,
    "skal": "ingen arkivögonblicksbild kunde skapas",
    "datum": "2026-07-27"
  },
  {
    "handling_id": "h-2026-14863",
    "koppling_id": "k-2026-0005",
    "kalla_url": "https://data.riksdagen.se/dokument/HC11184",
    "arkiv_url": null,
    "verifierad": false,
    "skal": "ingen arkivögonblicksbild kunde skapas",
    "datum": "2026-07-27"
  },
  {
    "handling_id": "h-2026-15220",
    "koppling_id": "k-2026-0006",
    "kalla_url": "https://data.riksdagen.se/dokument/HC11541",
    "arkiv_url": null,
    "verifierad": false,
    "skal": "ingen arkivögonblicksbild kunde skapas",
    "datum": "2026-07-27"
  },
  {
    "handling_id": "h-2026-17357",
    "koppling_id": "k-2026-0007",
    "kalla_url": "https://data.riksdagen.se/dokument/HD02608",
    "arkiv_url": null,
    "verifierad": false,
    "skal": "ingen arkivögonblicksbild kunde skapas",
    "datum": "2026-07-27"
  },
  {
    "handling_id": "h-2026-6464",
    "koppling_id": "k-2026-0008",
    "kalla_url": "https://data.riksdagen.se/dokument/HB021910",
    "arkiv_url": "https://web.archive.org/web/20231204235453/https://data.riksdagen.se/dokument/HB021910",
    "verifierad": true,
    "datum": "2026-07-27"
  },
  {
    "handling_id": "h-2026-6612",
    "koppling_id": "k-2026-0009",
    "kalla_url": "https://data.riksdagen.se/dokument/HB022058",
    "arkiv_url": "https://web.archive.org/web/20231204234512/https://data.riksdagen.se/dokument/HB022058",
    "verifierad": true,
    "datum": "2026-07-27"
  },
  {
    "handling_id": "h-2026-10284",
    "koppling_id": "k-2026-0011",
    "kalla_url": "https://data.riksdagen.se/dokument/HC0243",
    "arkiv_url": null,
    "verifierad": false,
    "skal": "ingen arkivögonblicksbild kunde skapas",
    "datum": "2026-07-27"
  },
  {
    "handling_id": "h-2026-1503",
    "koppling_id": "k-2026-0014",
    "kalla_url": "https://data.riksdagen.se/dokument/HA021503",
    "arkiv_url": null,
    "verifierad": false,
    "skal": "ingen arkivögonblicksbild kunde skapas",
    "datum": "2026-07-27"
  },
  {
    "handling_id": "h-2026-13677",
    "koppling_id": "k-2026-0015",
    "kalla_url": "https://data.riksdagen.se/dokument/HC023436",
    "arkiv_url": null,
    "verifierad": false,
    "skal": "ingen arkivögonblicksbild kunde skapas",
    "datum": "2026-07-27"
  },
  {
    "handling_id": "h-2026-11150",
    "koppling_id": "k-2026-0016",
    "kalla_url": "https://data.riksdagen.se/dokument/HC02909",
    "arkiv_url": null,
    "verifierad": false,
    "skal": "ingen arkivögonblicksbild kunde skapas",
    "datum": "2026-07-27"
  },
  {
    "handling_id": "h-2026-12083",
    "koppling_id": "k-2026-0017",
    "kalla_url": "https://data.riksdagen.se/dokument/HC021842",
    "arkiv_url": null,
    "verifierad": false,
    "skal": "ingen arkivögonblicksbild kunde skapas",
    "datum": "2026-07-27"
  },
  {
    "handling_id": "h-2026-1119",
    "koppling_id": "k-2026-0018",
    "kalla_url": "https://data.riksdagen.se/dokument/HA021324",
    "arkiv_url": "https://web.archive.org/web/20221124095039/https://data.riksdagen.se/dokument/HA021324",
    "verifierad": true,
    "datum": "2026-07-27"
  },
  {
    "handling_id": "h-2026-2601",
    "koppling_id": "k-2026-0019",
    "kalla_url": "https://data.riksdagen.se/dokument/HA1023",
    "arkiv_url": "https://web.archive.org/web/20221215084126/https://data.riksdagen.se/dokument/HA1023",
    "verifierad": true,
    "datum": "2026-07-27"
  },
  {
    "handling_id": "h-2026-0377",
    "koppling_id": "k-2026-0020",
    "kalla_url": "https://data.riksdagen.se/dokument/HA02377",
    "arkiv_url": "https://web.archive.org/web/20221122101101/https://data.riksdagen.se/dokument/HA02377",
    "verifierad": true,
    "datum": "2026-07-27"
  },
  {
    "handling_id": "h-2026-5394",
    "koppling_id": "k-2026-0023",
    "kalla_url": "https://data.riksdagen.se/dokument/HB021073",
    "arkiv_url": "https://web.archive.org/web/20231204233438/https://data.riksdagen.se/dokument/HB021073",
    "verifierad": true,
    "datum": "2026-07-27"
  },
  {
    "handling_id": "h-2026-1727",
    "koppling_id": "k-2026-0024",
    "kalla_url": "https://data.riksdagen.se/dokument/HA021727",
    "arkiv_url": "https://web.archive.org/web/20221124090709/https://data.riksdagen.se/dokument/HA021727",
    "verifierad": true,
    "datum": "2026-07-27"
  },
  {
    "handling_id": "h-2026-19050",
    "koppling_id": "k-2026-0025",
    "kalla_url": "https://data.riksdagen.se/dokument/HD022300",
    "arkiv_url": null,
    "verifierad": false,
    "skal": "ingen arkivögonblicksbild kunde skapas",
    "datum": "2026-07-27"
  },
  {
    "handling_id": "h-2026-9542",
    "koppling_id": "k-2026-0026",
    "kalla_url": "https://data.riksdagen.se/dokument/HB111017",
    "arkiv_url": null,
    "verifierad": false,
    "skal": "ingen arkivögonblicksbild kunde skapas",
    "datum": "2026-07-27"
  },
  {
    "handling_id": "h-2026-17671",
    "koppling_id": "k-2026-0027",
    "kalla_url": "https://data.riksdagen.se/dokument/HD02861",
    "arkiv_url": null,
    "verifierad": false,
    "skal": "ingen arkivögonblicksbild kunde skapas",
    "datum": "2026-07-27"
  },
  {
    "handling_id": "h-2026-10683",
    "koppling_id": "k-2026-0028",
    "kalla_url": "https://data.riksdagen.se/dokument/HC02442",
    "arkiv_url": null,
    "verifierad": false,
    "skal": "ingen arkivögonblicksbild kunde skapas",
    "datum": "2026-07-27"
  },
  {
    "handling_id": "h-2026-0838",
    "koppling_id": "k-2026-0029",
    "kalla_url": "https://data.riksdagen.se/dokument/HA021043",
    "arkiv_url": "https://web.archive.org/web/20221124093250/https://data.riksdagen.se/dokument/HA021043",
    "verifierad": false,
    "skal": "citatet stod inte ord för ord i ögonblicksbilden",
    "datum": "2026-07-27"
  },
  {
    "handling_id": "h-2026-10580",
    "koppling_id": "k-2026-0030",
    "kalla_url": "https://data.riksdagen.se/dokument/HC02339",
    "arkiv_url": null,
    "verifierad": false,
    "skal": "ingen arkivögonblicksbild kunde skapas",
    "datum": "2026-07-27"
  },
  {
    "handling_id": "h-2026-12244",
    "koppling_id": "k-2026-0031",
    "kalla_url": "https://data.riksdagen.se/dokument/HC022003",
    "arkiv_url": null,
    "verifierad": false,
    "skal": "ingen arkivögonblicksbild kunde skapas",
    "datum": "2026-07-27"
  },
  {
    "handling_id": "h-2026-18418",
    "koppling_id": "k-2026-0032",
    "kalla_url": "https://data.riksdagen.se/dokument/HD021668",
    "arkiv_url": null,
    "verifierad": false,
    "skal": "ingen arkivögonblicksbild kunde skapas",
    "datum": "2026-07-27"
  },
  {
    "handling_id": "h-2026-12528",
    "koppling_id": "k-2026-0033",
    "kalla_url": "https://data.riksdagen.se/dokument/HC022288",
    "arkiv_url": null,
    "verifierad": false,
    "skal": "ingen arkivögonblicksbild kunde skapas",
    "datum": "2026-07-27"
  },
  {
    "handling_id": "h-2026-12333",
    "koppling_id": "k-2026-0034",
    "kalla_url": "https://data.riksdagen.se/dokument/HC022092",
    "arkiv_url": null,
    "verifierad": false,
    "skal": "ingen arkivögonblicksbild kunde skapas",
    "datum": "2026-07-27"
  },
  {
    "handling_id": "h-2026-0781",
    "koppling_id": "k-2026-0037",
    "kalla_url": "https://data.riksdagen.se/dokument/HA02781",
    "arkiv_url": "https://web.archive.org/web/20221122100900/https://data.riksdagen.se/dokument/HA02781",
    "verifierad": false,
    "skal": "citatet stod inte ord för ord i ögonblicksbilden",
    "datum": "2026-07-27"
  },
  {
    "handling_id": "h-2026-0667",
    "koppling_id": "k-2026-0038",
    "kalla_url": "https://data.riksdagen.se/dokument/HA02667",
    "arkiv_url": "https://web.archive.org/web/20221122100921/https://data.riksdagen.se/dokument/HA02667",
    "verifierad": false,
    "skal": "citatet stod inte ord för ord i ögonblicksbilden",
    "datum": "2026-07-27"
  },
  {
    "handling_id": "h-2026-12789",
    "koppling_id": "k-2026-0041",
    "kalla_url": "https://data.riksdagen.se/dokument/HC022549",
    "arkiv_url": null,
    "verifierad": false,
    "skal": "ingen arkivögonblicksbild kunde skapas",
    "datum": "2026-07-27"
  },
  {
    "handling_id": "h-2026-6817",
    "koppling_id": "k-2026-0043",
    "kalla_url": "https://data.riksdagen.se/dokument/HB022263",
    "arkiv_url": "https://web.archive.org/web/20231204234838/https://data.riksdagen.se/dokument/HB022263",
    "verifierad": true,
    "datum": "2026-07-27"
  },
  {
    "handling_id": "h-2026-12982",
    "koppling_id": "k-2026-0050",
    "kalla_url": "https://data.riksdagen.se/dokument/HC022741",
    "arkiv_url": null,
    "verifierad": false,
    "skal": "ingen arkivögonblicksbild kunde skapas",
    "datum": "2026-07-27"
  },
  {
    "handling_id": "h-2026-18152",
    "koppling_id": "k-2026-0052",
    "kalla_url": "https://data.riksdagen.se/dokument/HD021402",
    "arkiv_url": null,
    "verifierad": false,
    "skal": "ingen arkivögonblicksbild kunde skapas",
    "datum": "2026-07-27"
  },
  {